Date,Name,Email B2B,Phone,Company Name,Message
02/23/2024 5:59:52 am,Mohit Kumar,mikkimeranaam@gmail.com,7065485345,Mikki,Looking forward for artist management.
02/23/2024 5:03:42 am,Sangam Tirkey,sangamtirkey40@gmail.com,'+919679523995',Caesar Roosevelt Music,"""I'm a singer and songwriter. I go by the artist name, Caesar Roosevelt and I'm looking for a management for my musical career."""
02/21/2024 6:43:55 pm,Rohit,denimrohit43@gmail.com,8920849478,Neerohit,We are band of two people and we have potential to entertain audience with our music. We can sing and play.
02/20/2024 9:54:47 am,Manraj Chauhan,manraj.c4@gmail.com,9930295124,Manraj Chauhan,"""I'm Manraj, an independent. I've been impressed by Artiste Firts's dedication to promoting unique talent, and I'm reaching out to explore potential collaboration opportunities. My latest project, a cheerful romantic song about having a crush, has garnered positive attention, and I believe that partnering with Artiste Firts could amplify its impact. I'd love to discuss how we could work together. Could we arrange a brief meeting to explore this further?"""
02/20/2024 4:32:04 am,Wajid ali,ishratjahan91088@gmail.com,9108835518,Amr,Wajid ali
02/16/2024 5:20:48 pm,Akuminba jamir,Akuminbajamir@gmail.com,9380690018,Trishan school of music,I want to contact music agency as a music artist to perform
02/16/2024 7:18:57 am,Parvinder kaur,parvinderksr@gmail.com,09899780926,No,"""I am an artist, Writing singing and music composer.Wants marketing of my product"""
02/15/2024 12:24:54 pm,Manraj Chauhan,manraj.c4@gmail.com,9930495214,Manraj Chauhan,I am an Independent artist since 3 years. I am looking for someone as a helping hand in building a strong market presence to gradually end up as an well-established artist
02/15/2024 8:15:33 am,test,test@gmail.com,8888888888,test,test
